{
  "v": 1,
  "typ": "cmd.derisk",
  "id": "01J9Z8QK3M7X2ABCDEFGHJKMNS",
  "acct": "acc_7f3a",
  "ts": "2026-08-15T02:10:00.000Z",
  "exp": "2026-08-15T02:15:00.000Z",
  "nonce": "9a1c77de",
  "seq": 41,
  "body": {
    "action": "pause",
    "scope": "all",
    "reason": "operator: 장중 이상 슬리피지 확인 중"
  }
}
